{
    "title": "Token Information Standard Schema",
    "type": "object",
    "$schema": "http://json-schema.org/draft-04/schema",
    "version": "1.1.0",

    "properties": {
        "tick": {
            "type": "string",
            "description": "The TICK name that represents the token"
        },
        "description": {
            "type": "string",
            "maxLength": 2048,
            "description": "A full text description of the token"
        },
        "html": {
            "type": "string",
            "maxLength": 10000,
            "description": "A snippet of HTML which can be displayed to provide additional token information and functionality"
        },
        "website": {
            "type": "string",
            "format": "uri",
            "maxLength": 255,
            "description": "A URI with more information the token"
        },
        "name": {
            "type": "string",
            "maxLength": 127,
            "description": "The full name of the token"
        },
        "owner": {
            "$ref": "#/definitions/owner",
            "description": "Information about the owner of this token"
        },
        "contacts": {
            "type": "array",
            "items": { "$ref": "#/definitions/contacts" },
            "uniqueItems": true,
            "description": "Information about how to contact the owner of this token"
        },
        "categories": {
            "type": "array",
            "items": { "$ref": "#/definitions/categories" },
            "uniqueItems": true,
            "description": "Information on what type of categories this token falls into"
        },
        "social": {
            "type": "array",
            "items": { "$ref": "#/definitions/social" },
            "description": "Social media accounts related to this token"
        },
        "images": {
            "type": "array",
            "items": { "$ref": "#/definitions/images" },
            "uniqueItems": true,
            "description": "One or more images used to represent the token."
        },
        "audio": {
            "type": "array",
            "items": { "$ref": "#/definitions/audio" },
            "uniqueItems": true,
            "description": "One or more audio files related to the token."
        },
        "video": {
            "type": "array",
            "items": { "$ref": "#/definitions/video" },
            "uniqueItems": true,
            "description": "One or more video files related to the token."
        },
        "files": {
            "type": "array",
            "items": { "$ref": "#/definitions/files" },
            "uniqueItems": true,
            "description": "One or more files related to the token."
        },
        "dns": {
            "type": "array",
            "items": { "$ref": "#/definitions/dns" },
            "uniqueItems": true,
            "description": "One or more DNS records related to the token."
        },
        "packs": {
            "type": "object",
            "additionalProperties": { "$ref": "#/definitions/pack" },
            "description": "Display metadata for token-gated content packs, keyed by pack id. A file entry joins a pack through its pack_id."
        }
    },

    "required": ["tick", "name"],

    "definitions": {

        "owner": {
            "type": "object",
            "properties": {
                "name": {
                    "type": "string",
                    "maxLength": 128,
                    "description": "The full name of the contact for the owner of this token"
                },
                "title": {
                    "type": "string",
                    "maxLength": 128,
                    "description": "The organization title for the owner of this token"
                },
                "organization": {
                    "type": "string",
                    "maxLength": 128,
                    "description": "The organization name that owns this token"
                }
            }
        },

        "categories": {
            "type": "object",
            "properties": {
                "type": {
                    "type": "string",
                    "enum": ["main", "sub", "other"],
                    "description": "Type of category being given (main, subcategory, other)"
                },
                "data": {
                    "type": "string",
                    "format": "string",
                    "maxLength": 255,
                    "description": "Description of the category"
                }
            },
            "required": ["type", "data"]
        },

        "contacts": {
            "type": "object",
            "properties": {
                "type": {
                    "type": "string",
                    "enum": ["address", "email", "phone", "fax", "url"],
                    "description": "Type of contact information that is being given"
                },
                "data": {
                    "type": "string",
                    "format": "string",
                    "maxLength": 255,
                    "description": "The contact information (address, email, phone, etc)"
                }
            },
            "required": ["type", "data"],
            "additionalProperties": false
        },

        "social": {
            "type": "object",
            "properties": {
                "type": {
                    "type": "string",
                    "description": "Type of social media account that is being given (github, facebook, twitter, telegram, discord, etc)"
                },
                "data": {
                    "type": "string",
                    "format": "string",
                    "maxLength": 255,
                    "description": "A URI for the social media account"
                }
            },
            "required": ["type", "data"]
        },

        "pack": {
            "type": "object",
            "properties": {
                "name": {
                    "type": "string",
                    "maxLength": 255,
                    "description": "Display name of the content pack"
                },
                "description": {
                    "type": "string",
                    "maxLength": 2048,
                    "description": "A description of what the content pack contains"
                }
            }
        },

        "images": {
            "type": "object",
            "properties": {
                "type": {
                    "enum": ["icon", "standard", "large", "hires"],
                    "description": "The type of image being given"
                },
                "size": {
                    "description": "The size of the image for pixel-based images or svg for SVG images"
                },
                "data": {
                    "type": "string",
                    "format": "string",
                    "maxLength": 255,
                    "description": "A URI to the image file"
                },
                "name": {
                    "type": "string",
                    "format": "string",
                    "maxLength": 255,
                    "description": "Name / Title of the image or artwork"
                },
                "hash": {
                    "type": "string",
                    "format": "string",
                    "maxLength": 64,
                    "description": "A sha256 hash of the image file"
                },
                "title": {
                    "type": "string",
                    "maxLength": 255,
                    "description": "Display title for this entry"
                },
                "data_ref": {
                    "type": "string",
                    "maxLength": 255,
                    "description": "Reference to an on-chain FILE action carrying the image bytes, by ACTION_INDEX: action:<index> on the token's own chain, or action:<COIN>:<index> on a sibling chain. Clients prefer data_ref over data when both are present."
                },
                "locked": {
                    "type": "boolean",
                    "description": "true when the referenced FILE is encrypted and token-gated, so a client can render a locked state without fetching it"
                },
                "pack_id": {
                    "type": "string",
                    "maxLength": 255,
                    "description": "Identifier of the content pack this entry belongs to; keys into the top-level packs map for display metadata"
                }
            },
            "required": ["type", "data"]
        },

        "audio": {
            "type": "object",
            "properties": {
                "type": {
                    "enum": ["m4a", "mp3", "wav"],
                    "description": "The type of audio file being given"
                },
                "data": {
                    "type": "string",
                    "format": "string",
                    "maxLength": 255,
                    "description": "A URI to the audio file"
                },
                "name": {
                    "type": "string",
                    "format": "string",
                    "maxLength": 255,
                    "description": "Name / Title of the audio or artwork"
                },
                "hash": {
                    "type": "string",
                    "format": "string",
                    "maxLength": 64,
                    "description": "A sha256 hash of the audio file"
                },
                "title": {
                    "type": "string",
                    "maxLength": 255,
                    "description": "Display title for this entry"
                },
                "data_ref": {
                    "type": "string",
                    "maxLength": 255,
                    "description": "Reference to an on-chain FILE action carrying the audio bytes, by ACTION_INDEX: action:<index> on the token's own chain, or action:<COIN>:<index> on a sibling chain. Clients prefer data_ref over data when both are present."
                },
                "locked": {
                    "type": "boolean",
                    "description": "true when the referenced FILE is encrypted and token-gated, so a client can render a locked state without fetching it"
                },
                "pack_id": {
                    "type": "string",
                    "maxLength": 255,
                    "description": "Identifier of the content pack this entry belongs to; keys into the top-level packs map for display metadata"
                }
            },
            "required": ["type", "data"]
        },

        "video": {
            "type": "object",
            "properties": {
                "type": {
                    "enum": ["mp4", "mov", "wmv"],
                    "description": "The type of video file being given"
                },
                "data": {
                    "type": "string",
                    "format": "string",
                    "maxLength": 255,
                    "description": "A URI to the video file"
                },
                "name": {
                    "type": "string",
                    "format": "string",
                    "maxLength": 255,
                    "description": "Name / Title of the video or artwork"
                },
                "hash": {
                    "type": "string",
                    "format": "string",
                    "maxLength": 64,
                    "description": "A sha256 hash of the video file"
                },
                "title": {
                    "type": "string",
                    "maxLength": 255,
                    "description": "Display title for this entry"
                },
                "data_ref": {
                    "type": "string",
                    "maxLength": 255,
                    "description": "Reference to an on-chain FILE action carrying the video bytes, by ACTION_INDEX: action:<index> on the token's own chain, or action:<COIN>:<index> on a sibling chain. Clients prefer data_ref over data when both are present."
                },
                "locked": {
                    "type": "boolean",
                    "description": "true when the referenced FILE is encrypted and token-gated, so a client can render a locked state without fetching it"
                },
                "pack_id": {
                    "type": "string",
                    "maxLength": 255,
                    "description": "Identifier of the content pack this entry belongs to; keys into the top-level packs map for display metadata"
                }
            },
            "required": ["type", "data"]
        },

        "files": {
            "type": "object",
            "properties": {
                "type": {
                    "description": "The type of file being given (doc, xls, pdf, other)"
                },
                "data": {
                    "type": "string",
                    "format": "string",
                    "maxLength": 255,
                    "description": "A URI to the file"
                },
                "name": {
                    "type": "string",
                    "format": "string",
                    "maxLength": 255,
                    "description": "Name / Title of the file"
                },
                "hash": {
                    "type": "string",
                    "format": "string",
                    "maxLength": 64,
                    "description": "A sha256 hash of the file"
                },
                "title": {
                    "type": "string",
                    "maxLength": 255,
                    "description": "Display title for this entry"
                },
                "data_ref": {
                    "type": "string",
                    "maxLength": 255,
                    "description": "Reference to an on-chain FILE action carrying the file bytes, by ACTION_INDEX: action:<index> on the token's own chain, or action:<COIN>:<index> on a sibling chain. Clients prefer data_ref over data when both are present."
                },
                "locked": {
                    "type": "boolean",
                    "description": "true when the referenced FILE is encrypted and token-gated, so a client can render a locked state without fetching it"
                },
                "pack_id": {
                    "type": "string",
                    "maxLength": 255,
                    "description": "Identifier of the content pack this entry belongs to; keys into the top-level packs map for display metadata"
                }
            },
            "required": ["type", "data"]
        },

        "dns": {
            "type": "object",
            "properties": {
                "type": {
                    "enum": [ "A", "AAAA", "ALIAS", "CAA", "CNAME", "NS", "SRV", "TXT", "URL", "MX", ""],
                    "description": "The type of DNS record"
                },
                "host": {
                    "type": "string",
                    "format": "string",
                    "maxLength": 255,
                    "description": "The hostname for this DNS record"
                },
                "value": {
                    "type": "string",
                    "format": "string",
                    "maxLength": 255,
                    "description": "The DNS value you wish to use for this record"
                },
                "priority": {
                    "type": "integer",
                    "format": "integer",
                    "maxLength": 3,
                    "description": "The record priority level"
                }
            },
            "if": {
                "properties": {
                    "type": { "const": "MX" }
                },
                "required": ["type"]
            },
            "then": { 
                "required": ["type", "host", "value", "priority"] 
            },
            "else": {
                "required": ["type", "host", "value"] 
            },
            "additionalProperties": false
        }
    }
}